{
  "prompt": "Tap where the strong safety lines up.",
  "diagram": {
    "diagramId": "football-formation-cover-3",
    "aspectRatio": 1.2,
    "alt": "Overhead diagram of a defensive formation with three deep defenders."
  },
  "hotspots": [
    {
      "id": "ss",
      "label": "Strong safety",
      "shape": {
        "kind": "circle",
        "cx": 0.62,
        "cy": 0.3,
        "r": 0.06
      }
    },
    {
      "id": "fs",
      "label": "Free safety",
      "shape": {
        "kind": "circle",
        "cx": 0.4,
        "cy": 0.2,
        "r": 0.06
      }
    }
  ],
  "correctHotspotIds": [
    "ss"
  ],
  "explanation": {
    "correct": "The strong safety sits on the side of the tight end.",
    "incorrect": "Find the tight end: the strong safety lines up on that side."
  }
}
